{
  "schema_version": "interview-context.v1",
  "context_id": "xhs:68c2572e000000001d00cffa:context-v1",
  "interview_note_id": "xhs:68c2572e000000001d00cffa",
  "source_revision_id": "xhs-note:68c2572e000000001d00cffa:snapshot-95b77bb26104",
  "review_status": "reviewed",
  "reviewed_at": "2026-09-14T00:00:00Z",
  "company": {
    "id": "meituan",
    "display_name": "美团",
    "basis": "source-explicit",
    "evidence_refs": [
      "raw-title:26届秋招:美团核心本地商业一面"
    ]
  },
  "role": {
    "family": "backend",
    "title": "后端",
    "basis": "reviewed-inference",
    "evidence_refs": [
      "note-desc:java"
    ]
  },
  "recruitment_type": {
    "value": "campus",
    "basis": "source-explicit",
    "evidence_refs": [
      "raw-title:26届秋招:美团核心本地商业一面"
    ]
  },
  "round": {
    "value": "1",
    "basis": "source-explicit",
    "evidence_refs": [
      "raw-title:26届秋招:美团核心本地商业一面"
    ]
  },
  "interview_occurred_at": {
    "precision": "unknown",
    "value": null,
    "basis": "unknown",
    "evidence_refs": []
  },
  "outcome_visibility": "sealed-until-source-reveal"
}