{
  "schema_version": "interview-context.v1",
  "context_id": "xhs:67c47750000000001203d0a9:context-v1",
  "interview_note_id": "xhs:67c47750000000001203d0a9",
  "source_revision_id": "xhs-note:67c47750000000001203d0a9:snapshot-95b77bb26104",
  "review_status": "reviewed",
  "reviewed_at": "2026-09-14T00:00:00Z",
  "company": {
    "id": "tencent",
    "display_name": "腾讯",
    "basis": "source-explicit",
    "evidence_refs": [
      "raw-title:腾讯Java后台开发-Hr部门"
    ]
  },
  "role": {
    "family": "backend",
    "title": "后端",
    "basis": "source-explicit",
    "evidence_refs": [
      "raw-title:腾讯Java后台开发-Hr部门"
    ]
  },
  "recruitment_type": {
    "value": "internship",
    "basis": "reviewed-inference",
    "evidence_refs": [
      "note-desc:#实习[话题]#"
    ]
  },
  "round": {
    "value": "unknown",
    "basis": "unknown",
    "evidence_refs": []
  },
  "interview_occurred_at": {
    "precision": "unknown",
    "value": null,
    "basis": "unknown",
    "evidence_refs": []
  },
  "outcome_visibility": "sealed-until-source-reveal"
}