{
  "schema_version": "interview-context.v1",
  "context_id": "xhs:68b154a8000000001c032fa1:context-v1",
  "interview_note_id": "xhs:68b154a8000000001c032fa1",
  "source_revision_id": "xhs-note:68b154a8000000001c032fa1:snapshot-95b77bb26104",
  "review_status": "reviewed",
  "reviewed_at": "2026-09-14T00:00:00Z",
  "company": {
    "id": "kuaishou",
    "display_name": "快手",
    "basis": "source-explicit",
    "evidence_refs": [
      "raw-title:快手测开实习一面"
    ]
  },
  "role": {
    "family": "qa",
    "title": "测试",
    "basis": "source-explicit",
    "evidence_refs": [
      "raw-title:快手测开实习一面"
    ]
  },
  "recruitment_type": {
    "value": "internship",
    "basis": "source-explicit",
    "evidence_refs": [
      "raw-title:快手测开实习一面"
    ]
  },
  "round": {
    "value": "1",
    "basis": "source-explicit",
    "evidence_refs": [
      "raw-title:快手测开实习一面"
    ]
  },
  "interview_occurred_at": {
    "precision": "unknown",
    "value": null,
    "basis": "unknown",
    "evidence_refs": []
  },
  "outcome_visibility": "sealed-until-source-reveal"
}