{
  "schema_version": "interview-context.v1",
  "context_id": "xhs:68c18d20000000001d0376f9:context-v1",
  "interview_note_id": "xhs:68c18d20000000001d0376f9",
  "source_revision_id": "xhs-note:68c18d20000000001d0376f9:snapshot-95b77bb26104",
  "review_status": "reviewed",
  "reviewed_at": "2026-09-14T00:00:00Z",
  "company": {
    "id": "bytedance",
    "display_name": "字节跳动",
    "basis": "source-explicit",
    "evidence_refs": [
      "raw-title:字节生活服务后端开发一面"
    ]
  },
  "role": {
    "family": "backend",
    "title": "后端",
    "basis": "source-explicit",
    "evidence_refs": [
      "raw-title:字节生活服务后端开发一面"
    ]
  },
  "recruitment_type": {
    "value": "unknown",
    "basis": "unknown",
    "evidence_refs": []
  },
  "round": {
    "value": "1",
    "basis": "source-explicit",
    "evidence_refs": [
      "raw-title:字节生活服务后端开发一面"
    ]
  },
  "interview_occurred_at": {
    "precision": "unknown",
    "value": null,
    "basis": "unknown",
    "evidence_refs": []
  },
  "outcome_visibility": "sealed-until-source-reveal"
}