{
  "schema_version": "interview-context.v1",
  "context_id": "xhs:66e0511a000000002603c3f4:context-v1",
  "interview_note_id": "xhs:66e0511a000000002603c3f4",
  "source_revision_id": "xhs-note:66e0511a000000002603c3f4:snapshot-95b77bb26104",
  "review_status": "reviewed",
  "reviewed_at": "2026-09-15T12:00:00Z",
  "company": {
    "id": "kuaishou",
    "display_name": "快手",
    "basis": "source-explicit",
    "evidence_refs": [
      "raw-title:9月10日快手Java三面复盘"
    ]
  },
  "role": {
    "family": "backend",
    "title": "后端",
    "basis": "reviewed-inference",
    "evidence_refs": [
      "raw-title:9月10日快手Java三面复盘"
    ]
  },
  "recruitment_type": {
    "value": "unknown",
    "basis": "unknown",
    "evidence_refs": []
  },
  "round": {
    "value": "3",
    "basis": "source-explicit",
    "evidence_refs": [
      "raw-title:9月10日快手Java三面复盘"
    ]
  },
  "interview_occurred_at": {
    "precision": "month_day",
    "value": "09-10",
    "basis": "source-explicit",
    "evidence_refs": [
      "raw-title:9月10日快手Java三面复盘"
    ]
  },
  "outcome_visibility": "sealed-until-source-reveal"
}
