{
  "schema_version": "interview-context.v1",
  "context_id": "xhs:661639d7000000001b00e951:context-v1",
  "interview_note_id": "xhs:661639d7000000001b00e951",
  "source_revision_id": "xhs-note:661639d7000000001b00e951:snapshot-95b77bb26104",
  "review_status": "reviewed",
  "reviewed_at": "2026-09-15T12:00:00Z",
  "company": {
    "id": "zhongan",
    "display_name": "众安保险",
    "basis": "source-explicit",
    "evidence_refs": [
      "raw-title:众安保险（Java开发实习）一面凉经"
    ]
  },
  "role": {
    "family": "backend",
    "title": "Java开发",
    "basis": "reviewed-inference",
    "evidence_refs": [
      "raw-title:众安保险（Java开发实习）一面凉经"
    ]
  },
  "recruitment_type": {
    "value": "internship",
    "basis": "source-explicit",
    "evidence_refs": [
      "raw-title:众安保险（Java开发实习）一面凉经"
    ]
  },
  "round": {
    "value": "1",
    "basis": "source-explicit",
    "evidence_refs": [
      "raw-title:众安保险（Java开发实习）一面凉经"
    ]
  },
  "interview_occurred_at": {
    "precision": "unknown",
    "value": null,
    "basis": "unknown",
    "evidence_refs": []
  },
  "outcome_visibility": "sealed-until-source-reveal"
}
