{
  "schema_version": "interview-context.v1",
  "context_id": "xhs:6809e0d6000000001c015fe6:context-v1",
  "interview_note_id": "xhs:6809e0d6000000001c015fe6",
  "source_revision_id": "xhs-note:6809e0d6000000001c015fe6:snapshot-95b77bb26104",
  "review_status": "reviewed",
  "reviewed_at": "2026-09-14T00:00:00Z",
  "company": {
    "id": "tencent-cloudwise",
    "display_name": "腾讯云智",
    "basis": "source-explicit",
    "evidence_refs": [
      "raw-title:腾讯云智26后台开发一面（30min）"
    ]
  },
  "role": {
    "family": "backend",
    "title": "后端",
    "basis": "source-explicit",
    "evidence_refs": [
      "raw-title:腾讯云智26后台开发一面（30min）"
    ]
  },
  "recruitment_type": {
    "value": "unknown",
    "basis": "unknown",
    "evidence_refs": []
  },
  "round": {
    "value": "1",
    "basis": "source-explicit",
    "evidence_refs": [
      "raw-title:腾讯云智26后台开发一面（30min）"
    ]
  },
  "interview_occurred_at": {
    "precision": "unknown",
    "value": null,
    "basis": "unknown",
    "evidence_refs": []
  },
  "outcome_visibility": "sealed-until-source-reveal"
}