{
  "schema_version": "interview-context.v1",
  "context_id": "xhs:6879bde9000000002203e9a6:context-v1",
  "interview_note_id": "xhs:6879bde9000000002203e9a6",
  "source_revision_id": "xhs-note:6879bde9000000002203e9a6:snapshot-95b77bb26104",
  "review_status": "reviewed",
  "reviewed_at": "2026-09-14T00:00:00Z",
  "company": {
    "id": "kuaishou",
    "display_name": "快手",
    "basis": "source-explicit",
    "evidence_refs": [
      "raw-title:快手一面"
    ]
  },
  "role": {
    "family": "backend",
    "title": "后端",
    "basis": "reviewed-inference",
    "evidence_refs": [
      "note-desc:后端"
    ]
  },
  "recruitment_type": {
    "value": "unknown",
    "basis": "unknown",
    "evidence_refs": []
  },
  "round": {
    "value": "1",
    "basis": "source-explicit",
    "evidence_refs": [
      "raw-title:快手一面"
    ]
  },
  "interview_occurred_at": {
    "precision": "unknown",
    "value": null,
    "basis": "unknown",
    "evidence_refs": []
  },
  "outcome_visibility": "sealed-until-source-reveal"
}