{
  "schema_version": "interview-context.v1",
  "context_id": "xhs:67c82942000000002903799e:context-v1",
  "interview_note_id": "xhs:67c82942000000002903799e",
  "source_revision_id": "xhs-note:67c82942000000002903799e:snapshot-95b77bb26104",
  "review_status": "reviewed",
  "reviewed_at": "2026-09-14T00:00:00Z",
  "company": {
    "id": "xiaomi",
    "display_name": "小米",
    "basis": "source-explicit",
    "evidence_refs": [
      "raw-title:小米hr面经"
    ]
  },
  "role": {
    "family": "backend",
    "title": "后端",
    "basis": "reviewed-inference",
    "evidence_refs": [
      "note-desc:后端"
    ]
  },
  "recruitment_type": {
    "value": "campus",
    "basis": "reviewed-inference",
    "evidence_refs": [
      "note-desc:#校招[话题]#"
    ]
  },
  "round": {
    "value": "hr",
    "basis": "source-explicit",
    "evidence_refs": [
      "raw-title:小米hr面经"
    ]
  },
  "interview_occurred_at": {
    "precision": "unknown",
    "value": null,
    "basis": "unknown",
    "evidence_refs": []
  },
  "outcome_visibility": "sealed-until-source-reveal"
}