{
  "schema_version": "interview-context.v1",
  "context_id": "xhs:6624d1dc00000000030236e8:context-v1",
  "interview_note_id": "xhs:6624d1dc00000000030236e8",
  "source_revision_id": "xhs-note:6624d1dc00000000030236e8:snapshot-95b77bb26104",
  "review_status": "reviewed",
  "reviewed_at": "2026-09-15T12:00:00Z",
  "company": {
    "id": "beike",
    "display_name": "贝壳",
    "basis": "source-explicit",
    "evidence_refs": [
      "raw-title:贝壳找房产品运营一天面完三面（已offer）"
    ]
  },
  "role": {
    "family": "other",
    "title": "产品运营",
    "basis": "source-explicit",
    "evidence_refs": [
      "raw-title:贝壳找房产品运营一天面完三面（已offer）"
    ]
  },
  "recruitment_type": {
    "value": "internship",
    "basis": "reviewed-inference",
    "evidence_refs": [
      "note-desc:什么时候能来实习"
    ]
  },
  "round": {
    "value": "unknown",
    "basis": "unknown",
    "evidence_refs": []
  },
  "interview_occurred_at": {
    "precision": "unknown",
    "value": null,
    "basis": "unknown",
    "evidence_refs": []
  },
  "outcome_visibility": "sealed-until-source-reveal"
}
