{
  "schema_version": "interview-context.v1",
  "context_id": "xhs:67ee3c15000000001c0327c9:context-v1",
  "interview_note_id": "xhs:67ee3c15000000001c0327c9",
  "source_revision_id": "xhs-note:67ee3c15000000001c0327c9:snapshot-95b77bb26104",
  "review_status": "reviewed",
  "reviewed_at": "2026-09-14T00:00:00Z",
  "company": {
    "id": "kuaishou",
    "display_name": "快手",
    "basis": "source-explicit",
    "evidence_refs": [
      "raw-title:快手测开面经"
    ]
  },
  "role": {
    "family": "qa",
    "title": "测试",
    "basis": "source-explicit",
    "evidence_refs": [
      "raw-title:快手测开面经"
    ]
  },
  "recruitment_type": {
    "value": "internship",
    "basis": "reviewed-inference",
    "evidence_refs": [
      "note-desc:#实习[话题]#"
    ]
  },
  "round": {
    "value": "unknown",
    "basis": "unknown",
    "evidence_refs": []
  },
  "interview_occurred_at": {
    "precision": "unknown",
    "value": null,
    "basis": "unknown",
    "evidence_refs": []
  },
  "outcome_visibility": "sealed-until-source-reveal"
}