{
  "schema_version": "interview-context.v1",
  "context_id": "xhs:67e4e85c000000001c004198:context-v1",
  "interview_note_id": "xhs:67e4e85c000000001c004198",
  "source_revision_id": "xhs-note:67e4e85c000000001c004198:snapshot-95b77bb26104",
  "review_status": "reviewed",
  "reviewed_at": "2026-09-14T00:00:00Z",
  "company": {
    "id": "baidu",
    "display_name": "百度",
    "basis": "source-explicit",
    "evidence_refs": [
      "raw-title:【百度]Java岗-四轮面试"
    ]
  },
  "role": {
    "family": "backend",
    "title": "后端",
    "basis": "source-explicit",
    "evidence_refs": [
      "raw-title:【百度]Java岗-四轮面试"
    ]
  },
  "recruitment_type": {
    "value": "unknown",
    "basis": "unknown",
    "evidence_refs": []
  },
  "round": {
    "value": "unknown",
    "basis": "unknown",
    "evidence_refs": []
  },
  "interview_occurred_at": {
    "precision": "unknown",
    "value": null,
    "basis": "unknown",
    "evidence_refs": []
  },
  "outcome_visibility": "sealed-until-source-reveal"
}