{
  "schema_version": "interview-context.v1",
  "context_id": "xhs:66a85cd2000000000502334d:context-v1",
  "interview_note_id": "xhs:66a85cd2000000000502334d",
  "source_revision_id": "xhs-note:66a85cd2000000000502334d:snapshot-95b77bb26104",
  "review_status": "reviewed",
  "reviewed_at": "2026-09-15T12:00:00Z",
  "company": {
    "id": "baidu",
    "display_name": "百度",
    "basis": "source-explicit",
    "evidence_refs": [
      "raw-title:百度算法实习面经分享"
    ]
  },
  "role": {
    "family": "algorithm",
    "title": "算法",
    "basis": "source-explicit",
    "evidence_refs": [
      "raw-title:百度算法实习面经分享"
    ]
  },
  "recruitment_type": {
    "value": "internship",
    "basis": "source-explicit",
    "evidence_refs": [
      "raw-title:百度算法实习面经分享"
    ]
  },
  "round": {
    "value": "unknown",
    "basis": "unknown",
    "evidence_refs": []
  },
  "interview_occurred_at": {
    "precision": "unknown",
    "value": null,
    "basis": "unknown",
    "evidence_refs": []
  },
  "outcome_visibility": "sealed-until-source-reveal"
}
