{
  "schema_version": "interview-context.v1",
  "context_id": "xhs:6751bdd200000000060178c0:context-v1",
  "interview_note_id": "xhs:6751bdd200000000060178c0",
  "source_revision_id": "xhs-note:6751bdd200000000060178c0:snapshot-95b77bb26104",
  "review_status": "reviewed",
  "reviewed_at": "2026-09-14T00:00:00Z",
  "company": {
    "id": null,
    "display_name": null,
    "basis": "unknown",
    "evidence_refs": []
  },
  "role": {
    "family": "backend",
    "title": "后端",
    "basis": "source-explicit",
    "evidence_refs": [
      "raw-title:36岁Java失业第35天：面试凉凉"
    ]
  },
  "recruitment_type": {
    "value": "social",
    "basis": "source-explicit",
    "evidence_refs": [
      "raw-title:36岁Java失业第35天：面试凉凉"
    ]
  },
  "round": {
    "value": "unknown",
    "basis": "unknown",
    "evidence_refs": []
  },
  "interview_occurred_at": {
    "precision": "unknown",
    "value": null,
    "basis": "unknown",
    "evidence_refs": []
  },
  "outcome_visibility": "sealed-until-source-reveal"
}