{
  "schema_version": "interview-context.v1",
  "context_id": "xhs:67d269630000000009039352:event:38afce391cae52a64601639d7fe29ba50c77ab9b33c35013c1a9a861bf7db2c4:context-v1",
  "interview_note_id": "xhs:67d269630000000009039352:event:38afce391cae52a64601639d7fe29ba50c77ab9b33c35013c1a9a861bf7db2c4",
  "source_revision_id": "xhs-note:67d269630000000009039352:snapshot-95b77bb26104",
  "review_status": "reviewed",
  "reviewed_at": "2026-09-14T00:00:00Z",
  "company": {
    "id": "bytedance",
    "display_name": "字节跳动",
    "basis": "source-explicit",
    "evidence_refs": [
      "raw-title:字节番茄Java实习一二面"
    ]
  },
  "role": {
    "family": "backend",
    "title": "后端",
    "basis": "reviewed-inference",
    "evidence_refs": [
      "raw-title:Java实习"
    ]
  },
  "recruitment_type": {
    "value": "internship",
    "basis": "source-explicit",
    "evidence_refs": [
      "raw-title:Java实习"
    ]
  },
  "round": {
    "value": "1",
    "basis": "reviewed-inference",
    "evidence_refs": [
      "note-desc:25.2.12 字节番茄一面"
    ]
  },
  "interview_occurred_at": {
    "precision": "exact",
    "value": "2025-02-12",
    "basis": "reviewed-inference",
    "evidence_refs": [
      "note-desc:25.2.12一面"
    ]
  },
  "outcome_visibility": "sealed-until-source-reveal"
}