{
  "schema_version": "interview-context.v1",
  "context_id": "xhs:6717a874000000001b0120f9:context-v1",
  "interview_note_id": "xhs:6717a874000000001b0120f9",
  "source_revision_id": "xhs-note:6717a874000000001b0120f9:snapshot-95b77bb26104",
  "review_status": "reviewed",
  "reviewed_at": "2026-09-14T00:00:00Z",
  "company": {
    "id": "didi",
    "display_name": "滴滴",
    "basis": "source-explicit",
    "evidence_refs": [
      "raw-title:滴滴大数据开发日常实习面经"
    ]
  },
  "role": {
    "family": "data",
    "title": "数据",
    "basis": "source-explicit",
    "evidence_refs": [
      "raw-title:滴滴大数据开发日常实习面经"
    ]
  },
  "recruitment_type": {
    "value": "internship",
    "basis": "source-explicit",
    "evidence_refs": [
      "raw-title:滴滴大数据开发日常实习面经"
    ]
  },
  "round": {
    "value": "1",
    "basis": "reviewed-inference",
    "evidence_refs": [
      "note-desc:滴滴大数据开发日常实习面经 电话一面 时间；40分钟 面试问题主要与项目相关， 我做的是风控用户画像的项目 1. 自我介"
    ]
  },
  "interview_occurred_at": {
    "precision": "unknown",
    "value": null,
    "basis": "unknown",
    "evidence_refs": []
  },
  "outcome_visibility": "sealed-until-source-reveal"
}