{
  "schema_version": "interview-context.v1",
  "context_id": "xhs:6685f7da000000001e010786:context-v1",
  "interview_note_id": "xhs:6685f7da000000001e010786",
  "source_revision_id": "xhs-note:6685f7da000000001e010786:snapshot-95b77bb26104",
  "review_status": "reviewed",
  "reviewed_at": "2026-09-15T12:00:00Z",
  "company": {
    "id": "tencent",
    "display_name": "腾讯",
    "basis": "source-explicit",
    "evidence_refs": [
      "raw-title:腾讯技术leader岗位都问些啥"
    ]
  },
  "role": {
    "family": "other",
    "title": "技术leader",
    "basis": "reviewed-inference",
    "evidence_refs": [
      "raw-title:腾讯技术leader岗位都问些啥"
    ]
  },
  "recruitment_type": {
    "value": "social",
    "basis": "reviewed-inference",
    "evidence_refs": [
      "raw-title:腾讯技术leader岗位都问些啥"
    ]
  },
  "round": {
    "value": "3",
    "basis": "source-explicit",
    "evidence_refs": [
      "note-desc:三面总结：在三面中，面试官更加关注我的系统架构设计能力"
    ]
  },
  "interview_occurred_at": {
    "precision": "unknown",
    "value": null,
    "basis": "unknown",
    "evidence_refs": []
  },
  "outcome_visibility": "sealed-until-source-reveal"
}
