{
  "schema_version": "interview-context.v1",
  "context_id": "xhs:6620d3a40000000004018523:context-v1",
  "interview_note_id": "xhs:6620d3a40000000004018523",
  "source_revision_id": "xhs-note:6620d3a40000000004018523:snapshot-95b77bb26104",
  "review_status": "reviewed",
  "reviewed_at": "2026-09-15T12:00:00Z",
  "company": {
    "id": "kuaishou",
    "display_name": "快手",
    "basis": "source-explicit",
    "evidence_refs": [
      "raw-title:0实习Java选手 | 快手我是什么很jian的人吗"
    ]
  },
  "role": {
    "family": "backend",
    "title": "后端",
    "basis": "reviewed-inference",
    "evidence_refs": [
      "raw-title:0实习Java选手 | 快手我是什么很jian的人吗"
    ]
  },
  "recruitment_type": {
    "value": "internship",
    "basis": "reviewed-inference",
    "evidence_refs": [
      "note-desc:#暑期实习[话题]#"
    ]
  },
  "round": {
    "value": "2",
    "basis": "source-explicit",
    "evidence_refs": [
      "note-desc:5.8二面 30min（已OC）"
    ]
  },
  "interview_occurred_at": {
    "precision": "month_day",
    "value": "05-08",
    "basis": "reviewed-inference",
    "evidence_refs": [
      "note-desc:5.8二面 30min（已OC）"
    ]
  },
  "outcome_visibility": "sealed-until-source-reveal"
}
