{
  "schema_version": "interview-context.v1",
  "context_id": "xhs:67c6d3300000000029031e93:event:2843edc4ce68da4d9debfa174dc24a61a20b1bc86fb29268d0de65423cb2f665:context-v1",
  "interview_note_id": "xhs:67c6d3300000000029031e93:event:2843edc4ce68da4d9debfa174dc24a61a20b1bc86fb29268d0de65423cb2f665",
  "source_revision_id": "xhs-note:67c6d3300000000029031e93:snapshot-95b77bb26104",
  "review_status": "reviewed",
  "reviewed_at": "2026-09-07T12:00:00Z",
  "company": {
    "id": "tencent",
    "display_name": "腾讯",
    "basis": "source-explicit",
    "evidence_refs": [
      "raw-title:腾讯暑假实习开发岗面经汇总"
    ]
  },
  "role": {
    "family": "backend",
    "title": "后端开发",
    "basis": "reviewed-inference",
    "evidence_refs": [
      "raw-title:腾讯暑假实习开发岗面经汇总"
    ]
  },
  "recruitment_type": {
    "value": "internship",
    "basis": "reviewed-inference",
    "evidence_refs": [
      "raw-title:腾讯暑假实习开发岗面经汇总"
    ]
  },
  "round": {
    "value": "unknown",
    "basis": "unknown",
    "evidence_refs": []
  },
  "interview_occurred_at": {
    "precision": "unknown",
    "value": null,
    "basis": "unknown",
    "evidence_refs": []
  },
  "outcome_visibility": "sealed-until-source-reveal"
}
