{
  "schema_version": "interview-context.v1",
  "context_id": "xhs:6721d99c000000003c01ba93:context-v1",
  "interview_note_id": "xhs:6721d99c000000003c01ba93",
  "source_revision_id": "xhs-note:6721d99c000000003c01ba93:snapshot-95b77bb26104",
  "review_status": "reviewed",
  "reviewed_at": "2026-09-14T00:00:00Z",
  "company": {
    "id": null,
    "display_name": null,
    "basis": "unknown",
    "evidence_refs": []
  },
  "role": {
    "family": "backend",
    "title": "后端",
    "basis": "source-explicit",
    "evidence_refs": [
      "raw-title:java开发gap半年找工记录(7)越面试越自信"
    ]
  },
  "recruitment_type": {
    "value": "unknown",
    "basis": "unknown",
    "evidence_refs": []
  },
  "round": {
    "value": "2",
    "basis": "reviewed-inference",
    "evidence_refs": [
      "note-desc:java开发gap半年找工记录(7)越面试越自信 🌈🌈🌈意识到面试的每个环节的结果都不是0或者1，回答Tech问题时，即"
    ]
  },
  "interview_occurred_at": {
    "precision": "unknown",
    "value": null,
    "basis": "unknown",
    "evidence_refs": []
  },
  "outcome_visibility": "sealed-until-source-reveal"
}